{
  "campaignId": "v3-gauntlet-smoke",
  "claimBoundary": "calibration-only",
  "entrant": {
    "model": "fixture-model",
    "processType": "other",
    "runtime": "fixture-runtime"
  },
  "evidence": {
    "claimBoundary": "calibration-only",
    "compactSummaryRef": "v3/examples/gauntlet/smoke/evidence/summary.calibration.md",
    "privateRefsBlocked": false,
    "publicSafe": true,
    "replayable": true,
    "requiredRefsMissing": [
      "visualPackageRef",
      "rubricRecordRef"
    ]
  },
  "laneId": "M",
  "mechanical": {
    "compositeScore": 95.833333,
    "determinism": {
      "details": "synthetic deterministic smoke fixture",
      "pass": true
    },
    "failedAcs": [
      "M24"
    ],
    "hiddenChallengeSummary": "public calibration-only fixture; no hidden challenge result",
    "passCount": 23,
    "protocolVersion": "2000m.driver.v3",
    "ranked": true,
    "regressionSummary": "synthetic regression status stable for smoke",
    "resultJsonRef": "v3/examples/gauntlet/smoke/evidence/mechanical-smoke-result.json",
    "totalAcs": 24
  },
  "protocolFreeze": {
    "calibrationOnlyIfChanged": true,
    "changedAfterLiveResults": false,
    "scorerMutationObserved": false
  },
  "scenarioId": "v3-workflow-gauntlet-smoke",
  "schemaVersion": "2000m.v3.result.v1",
  "taskSeed": 501,
  "visual": {
    "blockReason": "missing-capture-metadata",
    "captureDeterminism": "blocked",
    "ranked": false,
    "rubricRecordRef": "",
    "visualPackageRef": ""
  },
  "warnings": [
    "Synthetic calibration-only fixture; not a contender result."
  ],
  "workflow": {
    "contextWipeRecoveryScore": 70,
    "feedbackDecisionScore": 70,
    "finalRecommendation": "continue",
    "handoffScore": 75,
    "impossibleRequirementHandlingScore": 70,
    "rationaleRefs": [
      "v3/examples/gauntlet/smoke/evidence/summary.calibration.md"
    ],
    "regressionProtectionScore": 70
  }
}
