{
  "schemaVersion": "2000m.v3.result.v1",
  "campaignId": "v3-foundation-fixture",
  "scenarioId": "v3-foundation-scenario",
  "taskSeed": 101,
  "laneId": "A",
  "entrant": {
    "model": "fixture-model",
    "runtime": "fixture-runtime",
    "processType": "naked-model"
  },
  "protocolFreeze": {
    "changedAfterLiveResults": false,
    "scorerMutationObserved": false,
    "calibrationOnlyIfChanged": true
  },
  "mechanical": {
    "ranked": false,
    "protocolVersion": "2000m.driver.v3",
    "passCount": 0,
    "totalAcs": 24,
    "compositeScore": 0,
    "determinism": {
      "pass": true,
      "details": "fixture only"
    },
    "failedAcs": [
      "M01"
    ],
    "hiddenChallengeSummary": "not run",
    "regressionSummary": "not run",
    "resultJsonRef": "fixtures/mechanical-result.json"
  },
  "visual": {
    "ranked": false,
    "blockReason": "missing-native-capture-or-playable-surface",
    "visualPackageRef": "",
    "captureDeterminism": "blocked",
    "rubricRecordRef": ""
  },
  "workflow": {
    "contextWipeRecoveryScore": 0,
    "feedbackDecisionScore": 0,
    "regressionProtectionScore": 0,
    "impossibleRequirementHandlingScore": 0,
    "handoffScore": 0,
    "finalRecommendation": "redesign",
    "rationaleRefs": [
      "v3/SPEC_GAPS_AND_DECISIONS.md"
    ]
  },
  "evidence": {
    "replayable": false,
    "publicSafe": true,
    "privateRefsBlocked": false,
    "compactSummaryRef": "fixtures/summary.md",
    "requiredRefsMissing": [],
    "claimBoundary": "calibration-only"
  },
  "claimBoundary": "calibration-only",
  "warnings": [
    "Foundation fixture; not a contender result."
  ]
}
